Title,Court Line,Citation,OpinionURL,CourtListenerCaseName,Match
Bouchat v. Baltimore Ravens Ltd. Partnership,"United States Court of Appeals, Fourth Circuit.",737 F.3d 932,/opinion/174657/bouchat-v-baltimore-ravens-ltd-partnership/,Bouchat v. Baltimore Ravens Ltd. Partnership,100
Kienitz v. Sconnie Nation LLC,"United States Court of Appeals, Seventh Circuit.",766 F.3d 756,/opinion/8173497/kienitz-v-sconnie-nation-llc/,"Kienitz v. Sconnie Nation, LLC",100
Religious Technology Center v. Wollersheim,"United States Court of Appeals, Ninth Circuit.",971 F.2d 364,/opinion/8952110/religious-technology-center-v-wollersheim/,Religious Technology Center v. Wollersheim,100
Weissmann v. Freeman,"United States Court of Appeals, Second Circuit.",868 F.2d 1313,/opinion/1896828/weissmann-v-freeman/,Weissmann v. Freeman,100
Compaq Computer Corp. v. Ergonome Inc.,"United States Court of Appeals, Fifth Circuit.",387 F.3d 403,/opinion/36459/compaq-computer-corp-v-ergonome-inc/,Compaq Computer Corp. v. Ergonome Inc.,100
"Faulkner Literary Rights, LLC v. Sony Pictures Classics Inc.","United States District Court, N.D. Mississippi.",953 F.Supp.2d 701,/opinion/8726330/faulkner-literary-rights-llc-v-sony-pictures-classics-inc/,"Faulkner Literary Rights, LLC v. Sony Pictures Classics Inc.",100
"Brownmark Films, LLC v. Comedy Partners","United States District Court, E.D. Wisconsin.",800 F.Supp.2d 991,/opinion/801804/brownmark-films-llc-v-comedy-partners/,"Brownmark Films, LLC v. Comedy Partners",100
"Dr. Seuss Enterprises, L.P. v. ComicMix LLC","United States District Court, S.D. California.",372 F.Supp.3d 1101,/opinion/4840921/dr-seuss-enterprises-lp-v-comicmix-llc/,"Dr. Seuss Enterprises, L.P. v. Comicmix LLC",100
"Ranieri v. Adirondack Dev. Group, LLC","United States District Court, N.D. New York.",164 F.Supp.3d 305,/opinion/7318543/ranieri-v-adirondack-dev-group-llc/,"Ranieri v. Adirondack Dev. Group, LLC",100
Shropshire v. Canning,"United States District Court, N.D. California, San Jose Division.",809 F.Supp.2d 1139,/opinion/8709715/shropshire-v-canning/,Shropshire v. Canning,100
"Righthaven, LLC v. Hoehn","United States District Court, D. Nevada.",792 F.Supp.2d 1138,/opinion/2178608/righthaven-llc-v-hoehn/,"RIGHTHAVEN, LLC v. Hoehn",100
Graham v. Prince,"United States District Court, S.D. New York.",265 F.Supp.3d 366,/opinion/7326622/graham-v-prince/,Graham v. Prince,100
"National Football Scouting, Inc. v. Rang","United States District Court, W.D. Washington, at Tacoma.",912 F.Supp.2d 985,/opinion/8721405/national-football-scouting-inc-v-rang/,"National Football Scouting, Inc. v. Rang",100
Powell v. State,Court of Criminal Appeals of Alabama.,72 So.3d 1268,/opinion/9416004/powell-v-state/,Powell v. State,100
"Society of Holy Transfiguration Monastery, Inc. v. Gregory","United States Court of Appeals, First Circuit.",689 F.3d 29,/opinion/2470010/society-of-the-holy-transfiguration-monastery-inc-v-gregory/,"Society of the Holy Transfiguration Monastery, Inc. v. Gregory",100
"Louis Vuitton Malletier S.A. v. Haute Diggity Dog, LLC","United States Court of Appeals, Fourth Circuit.",507 F.3d 252,/opinion/1024255/louis-vuitton-malletier-sa-v-haute-diggity-dog-llc/,"Louis Vuitton Malletier S.A. v. Haute Diggity Dog, LLC",100
Mulcahy v. Cheetah Learning LLC,"United States Court of Appeals, Eighth Circuit.",386 F.3d 849,/opinion/788098/rita-mulcahy-v-cheetah-learning-llc-jeff-schurrer/,Rita Mulcahy v. Cheetah Learning LLC Jeff Schurrer,100
Swatch Group Management Services Ltd. v. Bloomberg L.P.,"United States Court of Appeals, Second Circuit.",756 F.3d 73,/opinion/2651068/swatch-group-management-services-ltd-v-bloomberg-lp/,"Swatch Group Management Services, Ltd. v. Bloomberg L.P.",100
Estate of Barré v. Carter,"United States District Court, E.D. Louisiana.",272 F.Supp.3d 906,/opinion/7327138/estate-of-barre-v-carter/,Estate of Barré v. Carter,100
McGucken v. Pub Ocean Limited,"United States Court of Appeals, Ninth Circuit.",42 F.4th 1149,/opinion/7853629/elliot-mcgucken-v-pub-ocean-limited/,Elliot McGucken v. Pub Ocean Limited,100
"Associated Press v. Meltwater U.S. Holdings, Inc.","United States District Court, S.D. New York.",931 F.Supp.2d 537,/opinion/8723643/associated-press-v-meltwater-us-holdings-inc/,"Associated Press v. Meltwater U.S. Holdings, Inc.",100
"Disney Enterprises, Inc. v. VidAngel, Inc.","United States District Court, C.D. California.",371 F.Supp.3d 708,/opinion/4421468/disney-enterprises-inc-v-vidangel-inc/,"Disney Enterprises, Inc. v. Vidangel, Inc.",100
"Roy Export Co. Establishment of Vaduz, Liechtenstein v. Columbia Broadcasting System, Inc.","United States Court of Appeals, Second Circuit.",672 F.2d 1095,/opinion/9041043/columbia-broadcasting-system-inc-v-roy-export-co-establishment/,"Columbia Broadcasting System, Inc. v. Roy Export Co. Establishment",100
"VHT, Inc. v. Zillow Group, Inc.","United States Court of Appeals, Ninth Circuit.",918 F.3d 723,/opinion/9404720/vht-inc-v-zillow-group-inc/,"Vht, Inc. v. Zillow Group, Inc.",100
Field v. Google Inc.,"United States District Court, D. Nevada.",412 F.Supp.2d 1106,/opinion/2408379/field-v-google-inc/,Field v. Google Inc.,100
"Software Freedom Conservancy, Inc. v. Westinghouse Digital Electronics, LLC","United States District Court, S.D. New York.",812 F.Supp.2d 483,/opinion/8709890/software-freedom-conservancy-inc-v-westinghouse-digital-electronics-llc/,"Software Freedom Conservancy, Inc. v. Westinghouse Digital Electronics, LLC",100
"Realnetworks, Inc. v. DVD Copy Control Ass'n","United States District Court, N.D. California.",641 F.Supp.2d 913,/opinion/8774552/realnetworks-inc-v-dvd-copy-control-assn/,"Realnetworks, Inc. v. DVD Copy Control Ass'n",100
Bassett v. Jensen,"United States District Court, D. Massachusetts.",459 F.Supp.3d 293,/opinion/7330960/bassett-v-jensen/,Bassett v. Jensen,100
"Google LLC v. Oracle America, Inc.",Supreme Court of the United States.,593 U.S. 1,/opinion/4898858/google-llc-v-oracle-america-inc/,"Google LLC v. Oracle America, Inc.",100
Cambridge University Press v. Becker,"United States District Court, N.D. Georgia, Atlanta Division.",371 F.Supp.3d 1218,/opinion/8715635/cambridge-university-press-v-becker/,Cambridge University Press v. Becker,100
Reyher v. Children's Television Workshop,"United States Court of Appeals, Second Circuit.",533 F.2d 87,/opinion/9010691/reyher-v-childrens-television-workshop/,Reyher v. Children's Television Workshop,100
Meeropol v. Nizer,"United States Court of Appeals, Second Circuit.",560 F.2d 1061,/opinion/9011819/meeropol-v-nizer/,Meeropol v. Nizer,100
de Fontbrune v. Wofsy,"United States District Court, N.D. California, San Jose Division.",409 F.Supp.3d 823,/opinion/6623312/vincent-de-fontbrune-v-alan-wofsy/,Vincent De Fontbrune v. Alan Wofsy,100
"Teter v. Glass Onion, Inc.","United States District Court, W.D. Missouri, Saint Joseph Division.",723 F.Supp.2d 1138,/opinion/2540865/teter-v-glass-onion-inc/,"Teter v. Glass Onion, Inc.",100
Adjmi v. DLT Entertainment Ltd.,"United States District Court, S.D. New York.",97 F.Supp.3d 512,/opinion/7312886/adjmi-v-dlt-entertainment-ltd/,Adjmi v. DLT Entertainment Ltd.,100
"Recursion Software, Inc. v. Interactive Intelligence, Inc.","United States District Court, N.D. Texas, Dallas Division.",425 F.Supp.2d 756,/opinion/2481445/recursion-software-inc-v-interactive-intelligence-inc/,"Recursion Software, Inc. v. Interactive Intelligence, Inc.",100
Hill v. Public Advocate of the United States,"United States District Court, D. Colorado.",35 F.Supp.3d 1347,/opinion/7307893/hill-v-public-advocate-of-united-states/,Hill v. Public Advocate of United States,100
Cambridge University Press v. Becker,"United States District Court, N.D. Georgia, Atlanta Division.",863 F.Supp.2d 1190,/opinion/8715635/cambridge-university-press-v-becker/,Cambridge University Press v. Becker,100
"Whyte Monkee Productions, LLC v. Netflix, Inc.","United States District Court, W.D. Oklahoma.",601 F.Supp.3d 1117,/opinion/9488433/whyte-monkee-productions-v-netflix/,Whyte Monkee Productions v. Netflix,100
"General Steel Domestic Sales, LLC v. Chumley","United States District Court, D. Colorado.",129 F.Supp.3d 1158,/opinion/7315605/general-steel-domestic-sales-llc-v-chumley/,"General Steel Domestic Sales, LLC v. Chumley",100
"Original Appalachian Artworks, Inc. v. Topps Chewing Gum, Inc.","United States District Court, N.D. Georgia, Atlanta Division.",642 F.Supp. 1031,/opinion/2398262/original-appalachian-artworks-inc-v-topps-chewing-gum-inc/,"Original Appalachian Artworks, Inc. v. Topps Chewing Gum, Inc.",100
"FMC Corp. v. Control Solutions, Inc.","United States District Court, E.D. Pennsylvania.",369 F.Supp.2d 539,/opinion/2361328/fmc-corp-v-control-solutions-inc/,"FMC Corp. v. Control Solutions, Inc.",100
"HEALTHeSTATE, LLC v. United States",United States Court of Federal Claims.,168 Fed.Cl. 624,/opinion/4759976/healthestate-llc-v-united-states/,"Healthestate, LLC v. United States",100
Walt Disney Productions v. Air Pirates,"United States Court of Appeals, Ninth Circuit.",581 F.2d 751,/opinion/1891375/walt-disney-productions-v-air-pirates/,Walt Disney Productions v. Air Pirates,100
"Whyte Monkee Productions, LLC v. Netflix, Inc.","United States Court of Appeals, Tenth Circuit.",97 F.4th 699,/opinion/9488433/whyte-monkee-productions-v-netflix/,Whyte Monkee Productions v. Netflix,100
Hustler Magazine Inc. v. Moral Majority Inc.,"United States Court of Appeals, Ninth Circuit.",796 F.2d 1148,/opinion/8952116/hustler-magazine-inc-v-moral-majority-inc/,"Hustler Magazine, Inc. v. Moral Majority, Inc.",100
"Northland Family Planning Clinic, Inc. v. Center for Bio-Ethical Reform","United States District Court, C.D. California.",868 F.Supp.2d 962,/opinion/8716261/northland-family-planning-clinic-inc-v-center-for-bio-ethical-reform/,"Northland Family Planning Clinic, Inc. v. Center for Bio-Ethical Reform",100
"Dr. Seuss Enterprises, L.P. v. ComicMix LLC","United States District Court, S.D. California.",300 F.Supp.3d 1073,/opinion/4840921/dr-seuss-enterprises-lp-v-comicmix-llc/,"Dr. Seuss Enterprises, L.P. v. Comicmix LLC",100
"Capitol Records, LLC v. ReDigi Inc.","United States District Court, S.D. New York.",934 F.Supp.2d 640,/opinion/8443791/capitol-records-llc-v-redigi-inc/,"Capitol Records, LLC v. Redigi Inc.",100
"DSMC, Inc. v. Convera Corp.","United States District Court, District of Columbia.",479 F.Supp.2d 68,/opinion/2347333/dsmc-inc-v-convera-corp/,"DSMC, INC. v. Convera Corp.",100
Monsarrat v. Newman,"United States District Court, D. Massachusetts.",514 F.Supp.3d 386,/opinion/6449991/monsarrat-v-newman/,Monsarrat v. Newman,100
"Apple, Inc. v. Psystar Corp.","United States District Court, N.D. California.",673 F.Supp.2d 931,/opinion/614359/apple-inc-v-psystar-corp/,Apple Inc. v. Psystar Corp.,100
"Sega Enterprises Ltd. v. Accolade, Inc.","United States Court of Appeals, Ninth Circuit.",977 F.2d 1510,/opinion/2144879/sega-enterprises-ltd-v-accolade-inc/,"Sega Enterprises Ltd. v. Accolade, Inc.",100
Golan v. Holder,Supreme Court of the United States,565 U.S. 302,/opinion/621044/golan-v-holder/,Golan v. Holder,100
Cariou v. Prince,"United States Court of Appeals, Second Circuit.",714 F.3d 694,/opinion/8413041/cariou-v-prince/,Cariou v. Prince,100
Bill Graham Archives v. Dorling Kindersley Ltd.,"United States Court of Appeals, Second Circuit.",448 F.3d 605,/opinion/2372265/bill-graham-archives-llc-v-dorling-kindersley-ltd/,"Bill Graham Archives, LLC v. Dorling Kindersley Ltd.",100
Cambridge University Press v. Patton,"United States Court of Appeals, Eleventh Circuit.",769 F.3d 1232,/opinion/2744045/cambridge-university-press-v-patton/,Cambridge University Press v. Patton,100
Bouchat v. Baltimore Ravens Ltd. Partnership,"United States Court of Appeals, Fourth Circuit.",619 F.3d 301,/opinion/174657/bouchat-v-baltimore-ravens-ltd-partnership/,Bouchat v. Baltimore Ravens Ltd. Partnership,100
Bell v. Eagle Mountain Saginaw Independent School District,"United States Court of Appeals, Fifth Circuit.",27 F.4th 313,/opinion/6445727/bell-v-eagle-mountain-saginaw/,Bell v. Eagle Mountain Saginaw,100
Morris v. Young,"United States District Court, C.D. California.",925 F.Supp.2d 1078,/opinion/8723031/morris-v-young/,Morris v. Young,100
"Peteski Productions, Inc. v. Rothman","United States District Court, E.D. Texas, Texarkana Division.",264 F.Supp.3d 731,/opinion/7326560/peteski-productions-inc-v-rothman/,"Peteski Productions, Inc. v. Rothman",100
"Basic Books, Inc. v. Kinko's Graphics Corp.","United States District Court, S.D. New York.",758 F.Supp. 1522,/opinion/1809457/basic-books-inc-v-kinkos-graphics-corp/,"Basic Books, Inc. v. Kinko's Graphics Corp.",100
Kienitz v. Sconnie Nation LLC,"United States District Court, W.D. Wisconsin.",965 F.Supp.2d 1042,/opinion/8173497/kienitz-v-sconnie-nation-llc/,"Kienitz v. Sconnie Nation, LLC",100
"Dr. Seuss Enterprises, L.P. v. Penguin Books USA, Inc.","United States Court of Appeals, Ninth Circuit.",109 F.3d 1394,/opinion/1471640/dr-seuss-enterprises-lp-v-penguin-books-usa-inc/,"Dr. Seuss Enterprises, L.P. v. Penguin Books USA, Inc.",100
Leibovitz v. Paramount Pictures Corp.,"United States Court of Appeals, Second Circuit.",137 F.3d 109,/opinion/2099103/leibovitz-v-paramount-pictures-corp/,Leibovitz v. Paramount Pictures Corp.,100
Micro Star v. Formgen Inc.,"United States Court of Appeals, Ninth Circuit.",154 F.3d 1107,/opinion/757702/micro-star-v-formgen-inc/,"Micro Star v. Formgen, Inc.",100
Warner Bros. Entertainment Inc. v. RDR Books,"United States District Court, S.D. New York.",575 F.Supp.2d 513,/opinion/1462047/warner-bros-entertainment-inc-v-rdr-books/,Warner Bros. Entertainment Inc. v. RDR Books,100
Thomas v. Artino,"United States District Court, D. Maryland.",723 F.Supp.2d 822,/opinion/2542538/thomas-v-artino/,Thomas v. Artino,100
"Healthcare Advocates, Inc. v. Harding, Earley, Follmer & Frailey","United States District Court, E.D. Pennsylvania.",497 F.Supp.2d 627,/opinion/1614840/healthcare-advocates-inc-v-harding-earley-follmer-frailey/,"Healthcare Advocates, Inc. v. Harding, Earley, Follmer & Frailey",100
Henley v. DeVore,"United States District Court, C.D. California.",733 F.Supp.2d 1144,/opinion/2474363/henley-v-devore/,Henley v. DeVore,100
Stern v. Does,"United States District Court, C.D. California.",978 F.Supp.2d 1031,/opinion/8729014/stern-v-does/,Stern v. Does,100
"Sony Computer Entertainment, Inc. v. Connectix Corp.","United States Court of Appeals, Ninth Circuit.",203 F.3d 596,/opinion/9261379/sony-computer-entertainment-inc-v-connectix-corp/,Sony Computer Entertainment Inc. v. Connectix Corp.,100
"Society of the Holy Transfiguration Monastery, Inc. v. Archbishop Gregory of Denver, Colorado","United States District Court, D. Massachusetts.",754 F.Supp.2d 219,/opinion/9241029/archbishop-gregory-of-denver-v-society-of-the-holy-transfiguration/,"Archbishop Gregory of Denver v. Society of the Holy Transfiguration Monastery, Inc.",100
"Fox Broadcasting Co., Inc. v. Dish Network L.L.C.","United States Court of Appeals, Ninth Circuit.",723 F.3d 1067,/opinion/8441691/fox-broadcasting-co-v-dish-network-llc/,Fox Broadcasting Co. v. Dish Network L.L.C.,100
"MCA, Inc. v. Wilson","United States Court of Appeals, Second Circuit.",677 F.2d 180,/opinion/8925543/mca-inc-v-wilson/,"MCA, Inc. v. Wilson",100
"Abend v. MCA, Inc.","United States Court of Appeals, Ninth Circuit.",863 F.2d 1465,/opinion/8974499/abend-v-mca-inc/,"Abend v. MCA, Inc.",100
Lennon v. Premise Media Corp.,"United States District Court, S.D. New York.",556 F.Supp.2d 310,/opinion/2391012/lennon-v-premise-media-corp/,Lennon v. Premise Media Corp.,100
"Andy Warhol Foundation for the Visual Arts, Inc. v. Goldsmith","United States District Court, S.D. New York.",382 F.Supp.3d 312,/opinion/10049691/andy-warhol-foundation-for-visual-arts-inc-v-goldsmith/,"Andy Warhol Foundation for Visual Arts, Inc. v. Goldsmith",100
"Andy Warhol Foundation for the Visual Arts, Inc. v. Goldsmith",Supreme Court of the United States.,598 U.S. 508,/opinion/10049691/andy-warhol-foundation-for-visual-arts-inc-v-goldsmith/,"Andy Warhol Foundation for Visual Arts, Inc. v. Goldsmith",100
"Religious Technology Center v. Netcom On-Line Communication Services, Inc.","United States District Court, N.D. California.",923 F.Supp. 1231,/opinion/2249916/religious-technology-center-v-netcom-on-line-communication-services-inc/,"Religious Technology Center v. Netcom On-Line Communication Services, Inc.",100
Bouchat v. NFL Properties LLC,"United States District Court, D. Maryland.",910 F.Supp.2d 798,/opinion/8721193/bouchat-v-nfl-properties-llc/,Bouchat v. NFL Properties LLC,100
Diversey v. Schmidly,"United States Court of Appeals, Tenth Circuit.",738 F.3d 1196,/opinion/2647270/diversey-v-schmidly/,Diversey v. Schmidly,100
"Fox News Network, LLC v. Tveyes, Inc.","United States Court of Appeals, Second Circuit.",883 F.3d 169,/opinion/4471221/fox-news-network-llc-v-tveyes-inc/,"Fox News Network, LLC v. TVEyes, Inc.",100
Davidson v. United States,United States Court of Federal Claims.,138 Fed.Cl. 159,/opinion/3200774/jorida-davidson-v-united-states/,JORIDA DAVIDSON v. UNITED STATES.,100
"Ringgold v. Black Entertainment Television, Inc.","United States Court of Appeals, Second Circuit.",126 F.3d 70,/opinion/746829/faith-ringgold-v-black-entertainment-television-inc-home-box-office/,"Faith Ringgold v. Black Entertainment Television, Inc., Home Box Office, Inc.",100
"Warner Bros. Inc. v. American Broadcasting Companies, Inc.","United States Court of Appeals, Second Circuit.",720 F.2d 231,/opinion/8924329/warner-bros-inc-v-american-broadcasting-companies-inc/,"Warner Bros. Inc. v. American Broadcasting Companies, Inc.",100
Lenz v. Universal Music Corp.,"United States Court of Appeals, Ninth Circuit.",801 F.3d 1126,/opinion/8432984/lenz-v-universal-music-corp/,Lenz v. Universal Music Corp.,100
Fioranelli v. CBS Broadcasting Inc.,"United States District Court, S.D. New York.",551 F.Supp.3d 199,/opinion/7323973/fioranelli-v-cbs-broadcasting-inc/,Fioranelli v. CBS Broadcasting Inc.,100
"In re DMCA Subpoena to Reddit, Inc.","United States District Court, N.D. California.",441 F.Supp.3d 875,/opinion/7336191/in-re-dmca-subpoena-to-reddit-inc/,"In re DMCA Subpoena To Reddit, Inc.",100
"Flo & Eddie, Inc. v. Sirius XM Radio, Inc.","United States District Court, S.D. New York.",62 F.Supp.3d 325,/opinion/5645521/flo-eddie-inc-v-sirius-xm-radio-inc/,"Flo & Eddie, Inc. v. Sirius XM Radio, Inc.",100
"Lowry's Reports, Inc. v. Legg Mason, Inc.","United States District court, D. Maryland, Northern Division.",271 F.Supp.2d 737,/opinion/2304104/lowrys-reports-inc-v-legg-mason-inc/,"Lowry's Reports, Inc. v. Legg Mason, Inc.",100
Granger v. Acme Abstract Co.,"United States District Court, D. New Jersey.",900 F.Supp.2d 419,/opinion/8719836/granger-v-acme-abstract-co/,Granger v. Acme Abstract Co.,100
"On Davis v. The Gap, Inc.","United States Court of Appeals, Second Circuit.",246 F.3d 152,/opinion/772795/on-davis-v-the-gap-inc/,"On Davis v. The Gap, Inc.",100
"Merkos L'Inyonei Chinuch, Inc. v. Otsar Sifrei Lubavitch, Inc.","United States Court of Appeals, Second Circuit.",312 F.3d 94,/opinion/780003/merkos-linyonei-chinuch-inc-v-otsar-sifrei-lubavitch-inc/,"Merkos L'InyoneI Chinuch, Inc. v. Otsar Sifrei Lubavitch, Inc.",100
"Keck v. Mix Creative Learning Center, L.L.C.","United States Court of Appeals, Fifth Circuit.",116 F.4th 448,/opinion/10121135/keck-v-mix-creative-learning-center/,Keck v. Mix Creative Learning Center,100
Cambridge University Press v. Albert,"United States Court of Appeals, Eleventh Circuit.",906 F.3d 1290,/opinion/4545716/cambridge-university-press-v-jl-albert/,Cambridge University Press v. J.L. Albert,100
Cambridge University Press v. Becker,"United States District Court, N.D. Georgia, Atlanta Division.",446 F.Supp.3d 1145,/opinion/8715635/cambridge-university-press-v-becker/,Cambridge University Press v. Becker,100
"Homeowner Options for Massachusetts Elders, Inc. v. Brookline Bancorp, Inc.","United States District Court, D. Massachusetts.",754 F.Supp.2d 201,/opinion/2169355/homeowner-options-for-massachusetts-elders-inc-v-brookline-bancorp-inc/,"Homeowner Options for Massachusetts Elders, Inc. v. Brookline Bancorp, Inc.",100
"Sony Corp. of America v. Universal City Studios, Inc.",Supreme Court of the United States,464 U.S. 417,/opinion/9350438/sony-corp-of-america-v-universal-city-studios-inc/,"Sony Corp. of America v. Universal City Studios, Inc.",100
"Worldwide Church of God v. Philadelphia Church of God, Inc.","United States Court of Appeals, Ninth Circuit.",227 F.3d 1110,/opinion/7081981/worldwide-church-of-god-v-philadelphia-church-of-god-inc/,"Worldwide Church of God v. Philadelphia Church of God, Inc.",100
"Andy Warhol Foundation for the Visual Arts, Inc. v. Goldsmith","United States Court of Appeals, Second Circuit.",992 F.3d 99,/opinion/10049691/andy-warhol-foundation-for-visual-arts-inc-v-goldsmith/,"Andy Warhol Foundation for Visual Arts, Inc. v. Goldsmith",100
"Hayden v. 2K Games, Inc.","United States District Court, N.D. Ohio, Eastern Division.",629 F.Supp.3d 736,/opinion/7335512/hayden-v-2k-games-inc/,"Hayden v. 2K Games, Inc.",100
Denison v. Larkin,"United States District Court, N.D. Illinois, Eastern Division.",64 F.Supp.3d 1127,/opinion/7310326/denison-v-larkin/,Denison v. Larkin,100
"Fox Broadcasting Co., Inc. v. Dish Network L.L.C.","United States Court of Appeals, Ninth Circuit.",747 F.3d 1060,/opinion/8441691/fox-broadcasting-co-v-dish-network-llc/,Fox Broadcasting Co. v. Dish Network L.L.C.,100
"Capitol Records, LLC v. ReDigi Inc.","United States Court of Appeals, Second Circuit.",910 F.3d 649,/opinion/8443791/capitol-records-llc-v-redigi-inc/,"Capitol Records, LLC v. Redigi Inc.",100
"Disney Enterprises, Inc. v. VidAngel, Inc.","United States Court of Appeals, Ninth Circuit.",869 F.3d 848,/opinion/4421468/disney-enterprises-inc-v-vidangel-inc/,"Disney Enterprises, Inc. v. Vidangel, Inc.",100
"American Broadcasting Companies, Inc. v. Aereo, Inc.",Supreme Court of the United States,573 U.S. 431,/opinion/8716938/american-broadcasting-companies-inc-v-aereo-inc/,"American Broadcasting Companies, Inc. v. Aereo, Inc.",100
"West Pub. Co. v. Mead Data Cent., Inc.","United States Court of Appeals, Eighth Circuit.",799 F.2d 1219,/opinion/475477/west-publishing-company-v-mead-data-central-inc/,"West Publishing Company v. Mead Data Central, Inc.",81
Gaylord v. U.S.,"United States Court of Appeals, Federal Circuit.",595 F.3d 1364,/opinion/2776456/gaylord-v-united-states/,Gaylord v. United States,82
"New Era Publications Intern., ApS v. Carol Pub. Group","United States Court of Appeals, Second Circuit.",904 F.2d 152,/opinion/1493264/new-era-publications-international-v-carol-publishing-group/,New Era Publications International v. Carol Publishing Group,83
Peterman v. Republican National Committee,"United States District Court, D. Montana, Missoula Division.",369 F.Supp.3d 1053,/opinion/7331097/peterman-v-republican-natl-comm/,Peterman v. Republican Nat'l Comm.,83
Peterman v. Republican National Committee,"United States District Court, D. Montana, Missoula Division.",320 F.Supp.3d 1151,/opinion/7331097/peterman-v-republican-natl-comm/,Peterman v. Republican Nat'l Comm.,83
"Red Label Music Publishing, Inc. v. Chila Productions","United States District Court, N.D. Illinois, Eastern Division.",388 F.Supp.3d 975,/opinion/8344502/red-label-music-publg-inc-v-chila-prods/,"Red Label Music Publ'g, Inc. v. Chila Prods.",84
Murphy v. Millennium Radio Group LLC,"United States Court of Appeals, Third Circuit.",650 F.3d 295,/opinion/218769/peter-murphy-v-millennium-radio-grp/,Peter Murphy v. Millennium Radio Grp,86
"Otto v. Hearst Communications, Inc.","United States District Court, S.D. New York.",345 F.Supp.3d 412,/opinion/7333002/otto-v-hearst-commcns-inc/,"Otto v. Hearst Commc'ns, Inc.",86
Estate of Smith v. Graham,"United States Court of Appeals, Second Circuit.",799 Fed.Appx. 36,/opinion/7319740/estate-of-graham-v-sothebys-inc/,"Estate of Graham v. Sotheby's, Inc.",86
Nunez v. Caribbean Intern. News Corp.,"United States Court of Appeals, First Circuit.",235 F.3d 18,/opinion/771448/sixto-nunez-v-caribbean-international-news-corp-el-vocero-de-puerto/,Sixto Nunez v. Caribbean International News Corp. (El Vocero De Puerto Rico),89
"Ty, Inc. v. Publications Intern. Ltd.","United States Court of Appeals, Seventh Circuit.",292 F.3d 512,/opinion/2500851/ty-inc-v-publications-international-ltd/,"TY, Inc. v. Publications International, Ltd.",90
"Tresóna Multimedia, LLC v. Burbank High School Vocal Music Association","United States Court of Appeals, Ninth Circuit.",953 F.3d 638,/opinion/4738644/tresona-multimedia-llc-v-burbank-high-vocal-music/,"Tresona Multimedia, LLC v. Burbank High Vocal Music",91
"SCQuARE Intern., Ltd. v. BBDO Atlanta, Inc.","United States District Court, N.D. Georgia, Atlanta Division.",455 F.Supp.2d 1347,/opinion/2427417/scquare-international-ltd-v-bbdo-atlanta-inc/,"SCQuARE International, Ltd. v. BBDO Atlanta, Inc.",91
"Maui Jim, Inc. v. SmartBuy Guru Enterprises","United States District Court, N.D. Illinois, Eastern Division.",459 F.Supp.3d 1058,/opinion/8344494/maui-jim-inc-v-smartbuy-guru-enters/,"Maui Jim, Inc. v. Smartbuy Guru Enters.",93
"Michael Grecco Productions, Inc. v. Valuewalk, LLC","United States District Court, S.D. New York.",345 F.Supp.3d 482,/opinion/7333007/michael-grecco-prods-inc-v-valuewalk-llc/,"Michael Grecco Prods., Inc. v. Valuewalk, LLC",93
"Lexmark Intern., Inc. v. Static Control Components, Inc.","United States Court of Appeals, Sixth Circuit.",387 F.3d 522,/opinion/807627/static-control-components-inc-v-lexmark-international-inc/,"Static Control Components, Inc. v. Lexmark International, Inc.",93
