Title,Court Line,Citation,OpinionURL,CourtListenerCaseName,Match
"Leadsinger, Inc. v. BMG Music Pub.","United States Court of Appeals, Ninth Circuit.",512 F.3d 522,/opinion/3050813/leadsinger-inc-v-bmg-music-publishing/,"Leadsinger, Inc. v. BMG Music Publishing",93
"FameFlynet, Inc. v. Jasmine Enterprises, Inc.","United States District Court, N.D. Illinois, Eastern Division.",344 F.Supp.3d 906,/opinion/8344278/fameflynet-inc-v-jasmine-enters-inc/,"FameFlynet, Inc. v. Jasmine Enters., Inc.",93
"Los Angeles News Service v. Reuters Television Intern., Ltd.","United States Court of Appeals, Ninth Circuit.",149 F.3d 987,/opinion/9224385/los-angeles-news-service-v-reuters-television-international-ltd/,"Los Angeles News Service v. Reuters Television International, Ltd.",94
"Twin Peaks Productions, Inc. v. Publications Intern., Ltd.","United States Court of Appeals, Second Circuit.",996 F.2d 1366,/opinion/9018616/twin-peaks-productions-inc-v-publications-international-ltd/,"Twin Peaks Productions, Inc. v. Publications International, Ltd.",94
"Rimini Street, Inc. v. Oracle International Corp.","United States District Court, D. Nevada.",473 F.Supp.3d 1158,/opinion/10293082/oracle-international-corporation-v-rimini-street-inc/,"Oracle International Corporation v. Rimini Street, Inc.",94