Title,Court Line,Citation,OpinionURL,CourtListenerCaseName,Match
"Gym Door Repairs, Inc. v. Young Equipment Sales, Inc.","United States District Court, S.D. New York.",206 F.Supp.3d 869,/opinion/7331944/gym-door-repairs-inc-v-young-equip-sales-inc/,"Gym Door Repairs, Inc. v. Young Equip. Sales, Inc.",95
"Bell v. Moawad Group, LLC","United States District Court, D. Arizona.",326 F.Supp.3d 918,/opinion/7331657/bell-v-moawad-grp-llc/,"Bell v. Moawad Grp., LLC",95
"Gym Door Repairs, Inc. v. Young Equipment Sales, Inc.","United States District Court, S.D. New York.",331 F.Supp.3d 221,/opinion/7331944/gym-door-repairs-inc-v-young-equip-sales-inc/,"Gym Door Repairs, Inc. v. Young Equip. Sales, Inc.",95
"MidlevelU, Inc. v. ACI Information Group","United States Court of Appeals, Eleventh Circuit.",989 F.3d 1205,/opinion/4860821/midlevelu-llc-v-aci-information-group/,"Midlevelu, LLC v. ACI Information Group",95
Infinity Broadcast Corp. v. Kirkwood,"United States Court of Appeals, Second Circuit.",150 F.3d 104,/opinion/2456581/infinity-broadcasting-corp-v-kirkwood/,Infinity Broadcasting Corp. v. Kirkwood,96
"Castle Rock Entertainment, Inc. v. Carol Pub. Group, Inc.","United States Court of Appeals, Second Circuit.",150 F.3d 132,/opinion/1516124/castle-rock-entertainment-v-carol-publishing-group-inc/,"Castle Rock Entertainment v. Carol Publishing Group, Inc.",96
"Peter Letterese And Associates, Inc. v. World Institute Of Scientology Enterprises","United States Court of Appeals, Eleventh Circuit.",533 F.3d 1287,/opinion/78080/peter-letterese-associates-inc-v-world-institute-of-scientology/,"Peter Letterese & Associates, Inc. v. World Institute of Scientology Enterprises, International",97
"Barcroft Media, Ltd. v. Coed Media Group, LLC","United States District Court, S.D. New York.",297 F.Supp.3d 339,/opinion/7329063/barcroft-media-ltd-v-coed-media-grp-llc/,"Barcroft Media, Ltd. v. Coed Media Grp., LLC",97
"Thomas M. Gilbert Architects, P.C. v. Accent Builders And Developers, LLC","United States Court of Appeals, Fourth Circuit.",377 Fed.Appx. 303,/opinion/2495238/thomas-m-gilbert-architects-pc-v-accent-builders-and-developers-llc/,"Thomas M. Gilbert Architects, PC v. Accent Builders and Developers, LLC",98
"Hachette Book Group, Inc. v. Internet Archive","United States Court of Appeals, Second Circuit.",115 F.4th 163,/opinion/10104144/hachette-book-group-inc-v-internet-archive/,"Hachette Book Group, Inc. v. Internet Archive",100
"In re DMCA Subpoena To Reddit, Inc.","United States District Court, N.D. California.",383 F.Supp.3d 900,/opinion/7336191/in-re-dmca-subpoena-to-reddit-inc/,"In re DMCA Subpoena To Reddit, Inc.",100
"Dr. Seuss Enterprises, L.P. v. ComicMix LLC","United States Court of Appeals, Ninth Circuit.",983 F.3d 443,/opinion/4840921/dr-seuss-enterprises-lp-v-comicmix-llc/,"Dr. Seuss Enterprises, L.P. v. Comicmix LLC",100
TCA Television Corp. v. McCollum,"United States Court of Appeals, Second Circuit.",839 F.3d 168,/opinion/8432484/tca-television-corp-v-mccollum/,TCA Television Corp. v. McCollum,100
"Arica Institute, Inc. v. Palmer","United States Court of Appeals, Second Circuit.",970 F.2d 1067,/opinion/2129850/arica-institute-inc-v-palmer/,"Arica Institute, Inc. v. Palmer",100
"Calibrated Success, Inc. v. Charters","United States District Court, E.D. Michigan, Southern Division.",72 F.Supp.3d 763,/opinion/7310931/calibrated-success-inc-v-charters/,"Calibrated Success, Inc. v. Charters",100
Fox Broadcasting Co. v. Dish Network LLC,"United States District Court, C.D. California.",160 F.Supp.3d 1139,/opinion/7318247/fox-broadcasting-co-v-dish-network-llc/,Fox Broadcasting Co. v. Dish Network LLC,100
"Warner Bros. Inc. v. American Broadcasting Companies, Inc.","United States Court of Appeals, Second Circuit.",654 F.2d 204,/opinion/8924329/warner-bros-inc-v-american-broadcasting-companies-inc/,"Warner Bros. Inc. v. American Broadcasting Companies, Inc.",100
"Chicago Bd. of Educ. v. Substance, Inc.","United States Court of Appeals, Seventh Circuit.",354 F.3d 624,/opinion/2996728/chicago-bd-educ-v-substance-inc/,Chicago Bd Educ v. Substance Inc,100
"Richards v. Merriam Webster, Inc.","United States District Court, D. Massachusetts.",55 F.Supp.3d 205,/opinion/7309443/richards-v-merriam-webster-inc/,"Richards v. Merriam Webster, Inc.",100
"Fox News Network, LLC v. TVEyes, Inc.","United States District Court, S.D. New York.",43 F.Supp.3d 379,/opinion/4471221/fox-news-network-llc-v-tveyes-inc/,"Fox News Network, LLC v. TVEyes, Inc.",100
"Authors Guild, Inc. v. HathiTrust","United States District Court, S.D. New York.",902 F.Supp.2d 445,/opinion/8441788/authors-guild-inc-v-hathitrust/,"Authors Guild, Inc. v. HathiTrust",100
"Fox News Network, LLC v. TVEyes, Inc.","United States District Court, S.D. New York.",124 F.Supp.3d 325,/opinion/4471221/fox-news-network-llc-v-tveyes-inc/,"Fox News Network, LLC v. TVEyes, Inc.",100
"Society of the Holy Transfiguration Monastery, Inc. v. Archbishop Gregory of Denver, Colorado","United States District Court, D. Massachusetts.",685 F.Supp.2d 217,/opinion/9241029/archbishop-gregory-of-denver-v-society-of-the-holy-transfiguration/,"Archbishop Gregory of Denver v. Society of the Holy Transfiguration Monastery, Inc.",100
"BWP Media USA, Inc. v. Gossip Cop Media, Inc.","United States District Court, S.D. New York.",196 F.Supp.3d 395,/opinion/7321154/bwp-media-usa-inc-v-gossip-cop-media-inc/,"BWP Media USA, Inc. v. Gossip Cop Media, Inc.",100
Kelly v. Arriba Soft Corp.,"United States Court of Appeals, Ninth Circuit.",336 F.3d 811,/opinion/782791/kelly-v-arriba-soft-corp/,Kelly v. Arriba Soft Corp.,100
"Mattel, Inc. v. Walking Mountain Productions","United States Court of Appeals, Ninth Circuit.",353 F.3d 792,/opinion/8437988/mattel-inc-v-walking-mountain-productions/,Mattel Inc. v. Walking Mountain Productions,100
"Newport News Holdings Corp. v. Virtual City Vision, Inc.","United States Court of Appeals, Fourth Circuit.",650 F.3d 423,/opinion/214905/newport-news-holdings-corp-v-virtual-city-vision-inc/,"Newport News Holdings Corp. v. Virtual City Vision, Inc.",100
Green v. U.S. Department of Justice,"United States District Court, District of Columbia.",392 F.Supp.3d 68,/opinion/4634289/green-v-us-department-of-justice/,Green v. U.S. Department of Justice,100
"Authors Guild v. Google, Inc.","United States Court of Appeals, Second Circuit.",804 F.3d 202,/opinion/8781589/authors-guild-v-google-inc/,"Authors Guild v. Google, Inc.",100
Galvin v. Illinois Republican Party,"United States District Court, N.D. Illinois, Eastern Division.",130 F.Supp.3d 1187,/opinion/7315674/galvin-v-illinois-republican-party/,Galvin v. Illinois Republican Party,100
Bell v. Powell,"United States District Court, S.D. Indiana, Indianapolis Division.",350 F.Supp.3d 723,/opinion/7333399/bell-v-powell/,Bell v. Powell,100
Lenz v. Universal Music Corp.,"United States Court of Appeals, Ninth Circuit.",815 F.3d 1145,/opinion/8432984/lenz-v-universal-music-corp/,Lenz v. Universal Music Corp.,100
Rogers v. Koons,"United States Court of Appeals, Second Circuit.",960 F.2d 301,/opinion/2259745/rogers-v-koons/,Rogers v. Koons,100
"Religious Technology Center v. Netcom On-Line Communication Services, Inc.","United States District Court, N.D. California.",907 F.Supp. 1361,/opinion/2249916/religious-technology-center-v-netcom-on-line-communication-services-inc/,"Religious Technology Center v. Netcom On-Line Communication Services, Inc.",100
"Faulkner Press, L.L.C. v. Class Notes, L.L.C.","United States District Court, N.D. Florida, Gainesville Division.",756 F.Supp.2d 1352,/opinion/2468740/faulkner-press-llc-v-class-notes-llc/,"Faulkner Press, L.L.C. v. Class Notes, L.L.C.",100
"Oracle America, Inc. v. Google Inc.","United States Court of Appeals, Federal Circuit.",750 F.3d 1339,/opinion/8716773/oracle-america-inc-v-google-inc/,"Oracle America, Inc. v. Google Inc.",100
De Fontbrune v. Wofsy,"United States Court of Appeals, Ninth Circuit.",39 F.4th 1214,/opinion/6623312/vincent-de-fontbrune-v-alan-wofsy/,Vincent De Fontbrune v. Alan Wofsy,100
NXIVM Corp. v. Ross Institute,"United States Court of Appeals, Second Circuit.",364 F.3d 471,/opinion/9279558/nxivm-corp-v-ross-institute/,NXIVM Corp. v. Ross Institute,100
"Hachette Book Group, Inc. v. Internet Archive","United States District Court, S.D. New York.",664 F.Supp.3d 370,/opinion/10104144/hachette-book-group-inc-v-internet-archive/,"Hachette Book Group, Inc. v. Internet Archive",100
"Arrow Productions, LTD. v. Weinstein Co. LLC","United States District Court, S.D. New York.",44 F.Supp.3d 359,/opinion/7308561/arrow-productions-ltd-v-weinstein-co/,"Arrow Productions, Ltd. v. Weinstein Co.",100
Corbello v. DeVito,"United States District Court, D. Nevada.",262 F.Supp.3d 1056,/opinion/7326420/corbello-v-devito/,Corbello v. Devito,100
Swatch Group Management Services Ltd. v. Bloomberg L.P.,"United States Court of Appeals, Second Circuit.",742 F.3d 17,/opinion/2651068/swatch-group-management-services-ltd-v-bloomberg-lp/,"Swatch Group Management Services, Ltd. v. Bloomberg L.P.",100
"Salinger v. Random House, Inc.","United States Court of Appeals, Second Circuit.",811 F.2d 90,/opinion/1662087/salinger-v-random-house-inc/,"Salinger v. Random House, Inc.",100
"Equals Three, LLC v. Jukin Media, Inc.","United States District Court, C.D. California.",139 F.Supp.3d 1094,/opinion/7316360/equals-three-llc-v-jukin-media-inc/,"Equals Three, LLC v. Jukin Media, Inc.",100
"Kennedy v. Gish, Sherwood & Friends, Inc.","United States District Court, E.D. Missouri, Eastern Division.",143 F.Supp.3d 898,/opinion/7316735/kennedy-v-gish-sherwood-friends-inc/,"Kennedy v. Gish, Sherwood & Friends, Inc.",100
Bell v. Eagle Mountain Saginaw Independent School District,"United States District Court, N.D. Texas, Fort Worth Division.",529 F.Supp.3d 605,/opinion/6445727/bell-v-eagle-mountain-saginaw/,Bell v. Eagle Mountain Saginaw,100
"Harper & Row Publishers, Inc. v. Nation Enterprises","United States Court of Appeals, Second Circuit.",723 F.2d 195,/opinion/111432/harper-row-publishers-inc-v-nation-enterprises/,"Harper & Row, Publishers, Inc. v. Nation Enterprises",100
"Design Basics, LLC v. Petros Homes, Inc.","United States District Court, N.D. Ohio, Eastern Division.",240 F.Supp.3d 712,/opinion/7324637/design-basics-llc-v-petros-homes-inc/,"Design Basics, LLC v. Petros Homes, Inc.",100
"Universal City Studios, Inc. v. Corley","United States Court of Appeals, Second Circuit.",273 F.3d 429,/opinion/775783/universal-city-studios-inc-v-corley/,"Universal City Studios, Inc. v. Corley",100
"Forest River, Inc. v. Heartland Recreational Vehicles, LLC","United States District Court, N.D. Indiana,",753 F.Supp.2d 753,/opinion/2470195/forest-river-inc-v-heartland-recreational-vehicles-llc/,"Forest River, Inc. v. Heartland Recreational Vehicles, LLC",100
Stern v. Lavender,"United States District Court, S.D. New York.",319 F.Supp.3d 650,/opinion/7330971/stern-v-lavender/,Stern v. Lavender,100
Myers v. Harold,"United States District Court, N.D. Illinois, Eastern Division.",279 F.Supp.3d 778,/opinion/6954319/myers-v-harold-lemay-investments-inc/,"Myers v. Harold LeMay Investments, Inc.",100
"Ticketmaster L.L.C. v. RMG Technologies, Inc.","United States District Court, C.D. California, Western Division.",507 F.Supp.2d 1096,/opinion/2009655/ticketmaster-llc-v-rmg-technologies-inc/,"Ticketmaster L.L.C. v. RMG Technologies, Inc.",100
"Campbell v. Acuff-Rose Music, Inc.",Supreme Court of the United States,510 U.S. 569,/opinion/9132655/campbell-v-acuff-rose-music-inc/,"Campbell v. Acuff-Rose Music, Inc.",100
Blanch v. Koons,"United States Court of Appeals, Second Circuit.",467 F.3d 244,/opinion/2416038/blanch-v-koons/,Blanch v. Koons,100
"A.V. ex rel. Vanderhye v. iParadigms, LLC","United States Court of Appeals, Fourth Circuit.",562 F.3d 630,/opinion/1028513/a-v-ex-rel-vanderhye-v-iparadigms-llc/,"A v. Ex Rel. Vanderhye v. Iparadigms, LLC",100
Hosseinzadeh v. Klein,"United States District Court, S.D. New York.",276 F.Supp.3d 34,/opinion/7327407/hosseinzadeh-v-klein/,Hosseinzadeh v. Klein,100
Institute for Development of Earth Awareness v. People for Ethical Treatment of Animals,"United States District Court, S.D. New York.",768 F.Supp.2d 672,/opinion/8777716/institute-for-the-development-of-earth-awareness-v-people-for-the-ethical/,Institute for the Development of Earth Awareness v. People for the Ethical Treatment of Animals,100
"Authors Guild, Inc. v. Google Inc.","United States District Court, S.D. New York.",954 F.Supp.2d 282,/opinion/8726429/authors-guild-inc-v-google-inc/,"Authors Guild, Inc. v. Google Inc.",100
"Oracle America, Inc. v. Google LLC","United States Court of Appeals, Federal Circuit.",886 F.3d 1179,/opinion/4898858/google-llc-v-oracle-america-inc/,"Google LLC v. Oracle America, Inc.",100
"Bridgeport Music, Inc. v. UMG Recordings, Inc.","United States Court of Appeals, Sixth Circuit.",585 F.3d 267,/opinion/1191661/bridgeport-music-inc-v-umg-recordings-inc/,"Bridgeport Music, Inc. v. UMG Recordings, Inc.",100
"Sofa Entertainment, Inc. v. Dodger Productions, Inc.","United States District Court, C.D. California.",782 F.Supp.2d 898,/opinion/854924/sofa-entertainment-inc-v-dodger-productions-inc/,"SOFA Entertainment, Inc. v. Dodger Productions, Inc.",100
Reiner v. Canale,"United States District Court, E.D. Michigan, Southern Division.",301 F.Supp.3d 727,/opinion/7329425/tc-reiner-v-canale/,TC Reiner v. Canale,100
"Estate of Smith v. Cash Money Records, Inc.","United States District Court, S.D. New York.",253 F.Supp.3d 737,/opinion/7325643/estate-of-smith-v-cash-money-records-inc/,"Estate of Smith v. Cash Money Records, Inc.",100
Olivares v. University of Chicago,"United States District Court, M.D. North Carolina.",213 F.Supp.3d 757,/opinion/7322235/olivares-v-university-of-chicago/,Olivares v. University of Chicago,100
"Zomba Enterprises, Inc. v. Panorama Records, Inc.","United States Court of Appeals, Sixth Circuit.",491 F.3d 574,/opinion/798186/zomba-enterprises-inc-v-panorama-records-inc/,"Zomba Enterprises, Inc. v. Panorama Records, Inc.",100
Fisher v. Dees,"United States Court of Appeals, Ninth Circuit.",794 F.2d 432,/opinion/7638804/state-ex-rel-fisher-v-dees/,State ex rel. Fisher v. Dees,100
"SOFA Entertainment, Inc. v. Dodger Productions, Inc.","United States Court of Appeals, Ninth Circuit.",709 F.3d 1273,/opinion/854924/sofa-entertainment-inc-v-dodger-productions-inc/,"SOFA Entertainment, Inc. v. Dodger Productions, Inc.",100
"American Society for Testing and Materials v. Public.Resource.Org, Inc.","United States Court of Appeals, District of Columbia Circuit.",82 F.4th 1262,/opinion/9425582/american-society-for-testing-and-materials-v-publicresourceorg-inc/,"American Society for Testing and Materials v. Public.Resource.Org, Inc.",100
"Video Pipeline, Inc. v. Buena Vista Home Entertainment, Inc.","United States Court of Appeals, Third Circuit.",342 F.3d 191,/opinion/9220575/video-pipeline-inc-v-buena-vista-home-entertainment-inc/,"Video Pipeline, Inc. v. Buena Vista Home Entertainment, Inc.",100
"Seltzer v. Green Day, Inc.","United States Court of Appeals, Ninth Circuit.",725 F.3d 1170,/opinion/1036738/dereck-seltzer-v-green-day-inc/,"Dereck Seltzer v. Green Day, Inc.",100
Stewart v. Abend,Supreme Court of the United States,495 U.S. 207,/opinion/9093056/stewart-v-abend/,Stewart v. Abend,100
"A&M Records, Inc. v. Napster, Inc.","United States Court of Appeals, Ninth Circuit.",239 F.3d 1004,/opinion/772042/am-records-inc-v-napster-inc/,"A&M Records, Inc. v. Napster, Inc.",100
"Balsley v. LFP, Inc.","United States Court of Appeals, Sixth Circuit.",691 F.3d 747,/opinion/806772/catherine-balsley-v-lfp-inc/,"Catherine Balsley v. LFP, Inc.",100
"Andy Warhol Foundation for Visual Arts, Inc. v. Goldsmith","United States Court of Appeals, Second Circuit.",11 F.4th 26,/opinion/9400076/andy-warhol-foundation-for-visual-arts-inc-v-goldsmith/,"Andy Warhol Foundation for Visual Arts, Inc. v. Goldsmith",100
"Harper & Row Publishers, Inc. v. Nation Enterprises",Supreme Court of the United States,471 U.S. 539,/opinion/111432/harper-row-publishers-inc-v-nation-enterprises/,"Harper & Row, Publishers, Inc. v. Nation Enterprises",100
Ferdman v. CBS Interactive Inc.,"United States District Court, S.D. New York.",342 F.Supp.3d 515,/opinion/7332793/ferdman-v-cbs-interactive-inc/,Ferdman v. CBS Interactive Inc.,100
"Oracle America, Inc. v. Google Inc.","United States District Court, N.D. California.",810 F.Supp.2d 1002,/opinion/8716773/oracle-america-inc-v-google-inc/,"Oracle America, Inc. v. Google Inc.",100
"Nihon Keizai Shimbun, Inc. v. Comline Business Data, Inc.","United States Court of Appeals, Second Circuit.",166 F.3d 65,/opinion/7076339/nihon-keizai-shimbun-inc-v-comline-business-data-inc/,"Nihon Keizai Shimbun, Inc. v. Comline Business Data, Inc.",100
Fravel v. Columbus Rehab. & Subacute Inst.,"Court of Appeals of Ohio, Tenth District, Franklin County.",53 N.E.3d 953,/opinion/6904174/fravel-v-columbus-rehab-subacute-inst/,Fravel v. Columbus Rehab. & Subacute Inst.,100
"Rosebud Entertainment, LLC v. Professional Laminating LLC","United States District court, D. Maryland, Northern Division.",958 F.Supp.2d 600,/opinion/8726813/rosebud-entertainment-llc-v-professional-laminating-llc/,"Rosebud Entertainment, LLC v. Professional Laminating LLC",100
Downing v. Abercrombie & Fitch,"United States Court of Appeals, Ninth Circuit.",265 F.3d 994,/opinion/7099748/downing-v-abercrombie-fitch/,Downing v. Abercrombie & Fitch,100
"Wright v. Warner Books, Inc.","United States Court of Appeals, Second Circuit.",953 F.2d 731,/opinion/1967274/wright-v-warner-books-inc/,"Wright v. Warner Books, Inc.",100
"Brammer v. Violent Hues Productions, LLC","United States Court of Appeals, Fourth Circuit.",922 F.3d 255,/opinion/4614196/russell-brammer-v-violent-hues-productions-llc/,"Russell Brammer v. Violent Hues Productions, LLC",100
"Disney Enterprises, Inc. v. VidAngel, Inc.","United States District Court, C.D. California.",224 F.Supp.3d 957,/opinion/4421468/disney-enterprises-inc-v-vidangel-inc/,"Disney Enterprises, Inc. v. Vidangel, Inc.",100
American Geophysical Union v. Texaco Inc.,"United States Court of Appeals, Second Circuit.",60 F.3d 913,/opinion/7030415/american-geophysical-union-v-texaco-inc/,American Geophysical Union v. Texaco Inc.,100
"Louis Vuitton Malletier, S.A. v. My Other Bag, Inc.","United States District Court, S.D. New York.",156 F.Supp.3d 425,/opinion/9334017/louis-vuitton-malletier-sa-v-my-other-bag-inc/,"Louis Vuitton Malletier, S.A. v. My Other Bag, Inc.",100
"Triangle Publications, Inc. v. Knight-Ridder Newspapers, Inc.","United States Court of Appeals, Fifth Circuit.",626 F.2d 1171,/opinion/1601229/triangle-publications-inc-v-knight-ridder-newspapers-inc/,"Triangle Publications, Inc. v. Knight-Ridder Newspapers, Inc.",100
Caner v. Autry,"United States District Court, W.D. Virginia, Lynchburg Division.",16 F.Supp.3d 689,/opinion/7306158/caner-v-autry/,Caner v. Autry,100
Swatch Group Management Services Ltd. v. Bloomberg L.P.,"United States District Court, S.D. New York.",861 F.Supp.2d 336,/opinion/2651068/swatch-group-management-services-ltd-v-bloomberg-lp/,"Swatch Group Management Services, Ltd. v. Bloomberg L.P.",100
"Dr. Seuss Enterprises, L.P. v. ComicMix LLC","United States District Court, S.D. California.",256 F.Supp.3d 1099,/opinion/4840921/dr-seuss-enterprises-lp-v-comicmix-llc/,"Dr. Seuss Enterprises, L.P. v. Comicmix LLC",100
"Threshold Media Corp. v. Relativity Media, LLC","United States District Court, C.D. California.",166 F.Supp.3d 1011,/opinion/7318776/threshold-media-corp-v-relativity-media-llc/,"Threshold Media Corp. v. Relativity Media, LLC",100
LaChapelle v. Fenty,"United States District Court, S.D. New York.",812 F.Supp.2d 434,/opinion/2147264/lachapelle-v-fenty/,LaChapelle v. Fenty,100
Cariou v. Prince,"United States District Court, S.D. New York.",784 F.Supp.2d 337,/opinion/8413041/cariou-v-prince/,Cariou v. Prince,100
CDK Global LLC v. Brnovich,"United States District Court, D. Arizona.",461 F.Supp.3d 906,/opinion/5296741/cdk-global-llc-v-mark-brnovich/,Cdk Global LLC v. Mark Brnovich,100
"Fitzgerald v. CBS Broadcasting, Inc.","United States District Court, D. Massachusetts.",491 F.Supp.2d 177,/opinion/2527470/fitzgerald-v-cbs-broadcasting-inc/,"Fitzgerald v. CBS Broadcasting, Inc.",100
"World Wrestling Federation Entertainment Inc. v. Big Dog Holdings, Inc.","United States District Court, W.D. Pennsylvania.",280 F.Supp.2d 413,/opinion/2501351/world-wrestling-federation-entertainment-inc-v-big-dog-holdings-inc/,"World Wrestling Federation Entertainment, Inc. v. Big Dog Holdings, Inc.",100
"Lewis Galoob Toys, Inc. v. Nintendo of America, Inc.","United States Court of Appeals, Ninth Circuit.",964 F.2d 965,/opinion/1445354/lewis-galoob-toys-inc-v-nintendo-of-america-inc/,"Lewis Galoob Toys, Inc. v. Nintendo of America, Inc.",100
Griner v. King,"United States Court of Appeals, Eighth Circuit.",104 F.4th 1,/opinion/9513484/laney-griner-v-king-for-congress/,Laney Griner v. King for Congress,100
Pieczenik v. Bayer Corp.,"United States Court of Appeals, Federal Circuit.",474 Fed.Appx. 766,/opinion/9238714/pieczenik-v-bayer-corp/,Pieczenik v. Bayer Corp.,100
Cheffins v. Stewart,"United States Court of Appeals, Ninth Circuit.",825 F.3d 588,/opinion/3210511/simon-cheffins-v-michael-stewart/,Simon Cheffins v. Michael Stewart,100
"Brownmark Films, LLC v. Comedy Partners","United States Court of Appeals, Seventh Circuit.",682 F.3d 687,/opinion/801804/brownmark-films-llc-v-comedy-partners/,"Brownmark Films, LLC v. Comedy Partners",100
"Designworks Homes, Inc. v. Columbia House of Brokers Realty, Inc.","United States Court of Appeals, Eighth Circuit.",126 F.4th 589,/opinion/10313399/designworks-homes-inc-v-columbia-house-of-brokers-realty-inc/,"Designworks Homes, Inc. v. Columbia House of Brokers Realty, Inc.",100
"American Society for Testing and Materials, et al. v. Public.Resource.Org, Inc.","United States Court of Appeals, District of Columbia Circuit.",896 F.3d 437,/opinion/2775613/american-society-for-testing-and-materials-v-publicresourceorg-inc/,"American Society for Testing and Materials v. public.resource.org, Inc.",100
"American Society for Testing and Materials v. Public.Resource.Org, Inc.","United States District Court, District of Columbia.",597 F.Supp.3d 213,/opinion/9425582/american-society-for-testing-and-materials-v-publicresourceorg-inc/,"American Society for Testing and Materials v. Public.Resource.Org, Inc.",100
"Straus v. DVC Worldwide, Inc.","United States District Court, S.D. Texas, Houston Division.",484 F.Supp.2d 620,/opinion/2444806/straus-v-dvc-worldwide-inc/,"Straus v. DVC Worldwide, Inc.",100
"Authors Guild, Inc. v. HathiTrust","United States Court of Appeals, Second Circuit.",755 F.3d 87,/opinion/8441788/authors-guild-inc-v-hathitrust/,"Authors Guild, Inc. v. HathiTrust",100
North Jersey Media Group Inc. v. Pirro,"United States District Court, S.D. New York.",74 F.Supp.3d 605,/opinion/7311073/north-jersey-media-group-inc-v-pirro/,North Jersey Media Group Inc. v. Pirro,100
"Louis Vuitton Malletier, S.A. v. My Other Bag, Inc.","United States Court of Appeals, Second Circuit.",674 Fed.Appx. 16,/opinion/9334017/louis-vuitton-malletier-sa-v-my-other-bag-inc/,"Louis Vuitton Malletier, S.A. v. My Other Bag, Inc.",100
Nichols v. Club for Growth Action,"United States District Court, District of Columbia.",235 F.Supp.3d 289,/opinion/7329292/nichols-v-club-for-growth-action/,Nichols v. Club for Growth Action,100
"Code Revision Commission v. Public.Resource.Org, Inc.","United States District Court, N.D. Georgia, Atlanta Division.",244 F.Supp.3d 1350,/opinion/7325010/code-revision-commission-v-publicresourceorg-inc/,"Code Revision Commission v. Public.Resource.Org, Inc.",100
Penguin Random House LLC v. Colting,"United States District Court, S.D. New York.",270 F.Supp.3d 736,/opinion/7326996/penguin-random-house-llc-v-colting/,Penguin Random House LLC v. Colting,100
Jackson v. Odenat,"United States District Court, S.D. New York.",9 F.Supp.3d 342,/opinion/7305528/jackson-v-odenat/,Jackson v. Odenat,100
BMG Music v. Gonzalez,"United States Court of Appeals, Seventh Circuit.",430 F.3d 888,/opinion/792601/bmg-music-v-gonzalez/,BMG Music v. Gonzalez,100
Monsarrat v. Newman,"United States Court of Appeals, First Circuit.",28 F.4th 314,/opinion/6449991/monsarrat-v-newman/,Monsarrat v. Newman,100
TCA Television Corp. v. McCollum,"United States District Court, S.D. New York.",151 F.Supp.3d 419,/opinion/8432484/tca-television-corp-v-mccollum/,TCA Television Corp. v. McCollum,100
Philpot v. Independent Journal Review,"United States Court of Appeals, Fourth Circuit.",92 F.4th 252,/opinion/9473084/larry-philpot-v-independent-journal-review/,Larry Philpot v. Independent Journal Review,100
"Monge v. Maya Magazines, Inc.","United States Court of Appeals, Ninth Circuit.",688 F.3d 1164,/opinion/806600/noelia-monge-v-maya-magazines-inc/,"Noelia Monge v. Maya Magazines, Inc.",100
Oyewole v. Ora,"United States District Court, S.D. New York.",291 F.Supp.3d 422,/opinion/7328518/oyewole-v-ora/,Oyewole v. Ora,100
Suntrust Bank v. Houghton Mifflin Co.,"United States Court of Appeals, Eleventh Circuit.",268 F.3d 1257,/opinion/2579839/suntrust-bank-v-houghton-mifflin-co/,Suntrust Bank v. Houghton Mifflin Co.,100
"Iowa State University Research Foundation, Inc. v. American Broadcasting Companies, Inc.","United States Court of Appeals, Second Circuit.",621 F.2d 57,/opinion/8922375/iowa-state-university-research-foundation-inc-v-american-broadcasting/,"Iowa State University Research Foundation, Inc. v. American Broadcasting Companies, Inc.",100
